title,vote_average,vote_count,revenue,runtime,adult,original_language,overview,popularity,tagline,genres,production_companies,production_countries,spoken_languages
Grandma and machine gun,0.0,0,0,15,False,lt,"Film about former battles of World War II veteran, machine gunner Danutė Stanelienė.",0.6,,Documentary,,,Lithuanian
Da Neve A Rosa,0.0,0,0,1,False,en,Short by Marinella Pirelli.,0.6,,,,,
Neil Patrick Harris: Circus Awesomeus,0.0,0,0,74,False,en,"Neil Patrick Harris hosts a variety show that features stand-up comedy, magic acts, juggling, sword-swallowers, puppets, ventriloquists and trapeze artists. Taped at Montreal's Just for Laughs Festival in July 2015.",0.721,,Comedy,,,English
Flamenco Ecstasy,0.0,0,0,0,True,it,,0.6,,Drama,"Ultimate Pictures, Adam & Eve, Capital Film (Porno)",Italy,Italian
Night Callers,0.0,0,0,120,True,en,"For the sleepless in Seattle, Gus Mattox stars as the host of a late-night dirty-talk radio show inviting callers to describe their wildest sexual encounters. Chi Chi LaRue directs as Jay Varella and bad boy Bobby Williams put on a show for the whole neighborhood; hunky Tyler Riggz and Luke Strong work out all their muscles at the gym; and Dereck Hanson, Jake Deckard, and Jon Galt steam up a truckstop men's room in a dripping threeway fuck-suck-and-rim-fest.  And when the radio show is over, the grand finale begins as Gus Mattox pairs with the sultry Nino Bacci for plenty of suck and fuck action... with a super-hot surprise twist at the end.",0.6,,,Unzipped Video,United States of America,
Serenal,5.2,4,0,4,False,en,"A gay fantasia of patterned sound in which Norman McLaren salutes the West Indies, painting the spirit of fiesta on film to the lively beat of an island tune by Trinidad's Grand Curacaya Orchestra.",0.711,,Animation,ONF | NFB,Canada,English
Street hookers,0.0,0,0,0,True,en,,0.6,,,,,
My Home,0.0,0,0,0,False,th,,0.0,,,,,
Glory: Who Will Compete,0.0,0,0,0,False,zh,"Rui Qi, an ordinary amusement park employee with a passion for e-sports, finds herself thrust into the competitive gaming world during the park's transformation. Facing prejudice from professional gamers and betrayal from former teammates, Rui Qi and her team endure numerous setbacks. Through unwavering dedication to e-sports, they overcome challenges and successfully embark on a professional gaming career.",0.9,,Science Fiction,,,Mandarin
YOKOHAMA BLACK 3,0.0,0,0,66,False,ja,The third 'YOKOHAMA BLACK' film.,1.465,,,All In Entertainment,Japan,Japanese
【今日】十大网投正规信誉网址,0.0,0,0,0,False,zh,,0.0,,,,,
Angel In The Family,0.0,0,0,136,True,en,"This is a family you'll wish was next door to you. They know it's taboo, but they just can't help themselves to a big serving of family cock!",0.6,,,Trans Angels,,
Bilge Ana Mevlüde Genç,0.0,0,0,0,False,tr,,0.0143,,Documentary,Kültür ve Turizm Bakanlığı,Turkey,Turkish
The Tale of Kat and Dog,0.0,0,0,18,False,en,A New Yorker trying to catch a flight home from Amsterdam has her travel disrupted by a (very) Dutch dog.,0.6,,Drama,,United States of America,English
The Stool Becomes the Ladder,0.0,0,0,6,False,en,"The Stool Becomes the Ladder was made in 1978, using techniques of video feedback, quantizing levels and chroma, and simple downstream text. The stool is transformed into a ladder.",0.6,,,,,
Ni d'Ève ni d'Adam,0.0,0,0,0,False,es,,0.6,,,,,
教材教学《导师一对一带赚钱》,0.0,0,0,0,False,zh,,0.0,,,,,
La formula de Rasputin,5.0,1,0,0,False,es,,0.6,,,,,
Gespenster,0.0,0,0,0,False,de,,0.841,,Drama,ZDF,Germany,German
Nirvana Live at the Paradiso,9.2,2,0,66,False,en,"Nirvana Recorded Live at the Paradiso in Amsterdam, on November 25th 1991.  Drain You, Aneurysm, School, Floyd the Barber, Smells Like Teen Spirit, About a Girl, Polly, Lithium, Sliver, Breed, Come as You Are, Been a Son, Negative Creep, On a Plain, Blew, Love Buzz, Territorial Pissings",0.722,,Music,,,
Infra Red Fred,0.0,0,0,1,False,en,A remote control changes a man’s life.,0.6,,,,,
佳期、假期,0.0,0,0,0,False,en,taiwan films,0.0,,,,,
I Want To Do It With Sola Aoi!,0.0,0,0,60,True,ja,"Sora Aoi, who is at the top of the AV world, offers serious fuck with popular sexual scenarios such as soapland, pink salon, image club, and date club! You can have a naughty naughty experience with Sora Chan! !",0.6,,,Alice Japan,,Japanese
The Best Man,0.0,0,0,22,False,en,"A bride and groom are all set to get married, but they can't until the best man shows up. When the best man eventually does show up, he causes a few problems since he ran through some tar just before entering the church. The groom doesn't seem to mind too much, just as long as the best man brought the ring, which he did. But as the wedding proceeds, that sticky tar just can't help but get the best man into one disastrous incident after another, including with the ring. That havoc, which leads into the reception, the wedding night and the honeymoon send off, may end the marriage even before it begins... or at least the couple's friendship with their best man.",1.358,,Comedy,Mack Sennett Comedies,United States of America,No Language
Аквариум: Квартирник у Мейерхольда,0.0,0,0,0,False,ru,,0.6,,Music,,Russia,
8 Hours Of Endless Five-Way Large Orgies! A 140cm-Tall Mini-Body Shaved Pussy Beautiful Girl Cosplayer 18 Years Old We’re Using The Powers Of Persuasion To Get Creampie Sex From Anybody Maso Breaking In Personality-Destroying Training At A Public Bathroom,0.0,0,0,150,True,ja,"Securing the 18-year-old beautiful girl layer who has been out of touch for about two months since the last training. She gave limit training to become a prostitution woman who can never go against it again. First of all, with the cooperation of a famous love magician, the whole body is genitalized and brainwashed. On top of that, it becomes a prey for sanctions by the hungry Kameko group, such as impregnated semen injection, iki tide injection and pussy destruction. Personality correction that punishes puffed-up layer girls. About 8 hours of work on site will be edited into a 150-minute work that concentrates the highlights.",0.6,The Shocking Finale A Double Feature Special,Documentary,ZenNihonKamekoKyodokumiai,Japan,Japanese
Sesame Street: Elmo Saves Christmas,6.2,10,0,60,False,en,"Can there be such a thing as too much Christmas? Find out... when a magical Christmas wish is granted and Elmo gets to see what the world would be like if every day were Christmas! You'll enjoy lots of songs and holiday cheer with Elmo and his new friend Lightning, the reindeer, and discover for yourself why Christmas is best kept to one day a year!",3.46,,"Family, Music, Adventure",Children's Television Workshop (CTW),United States of America,English
Hackers - Identity Theft,8.0,1,0,53,False,fr,"Cyberspace is more insecure than ever as hackers exploit human error and technical vulnerability to hold it to ransom for their personal data. Companies, public bodies, schools and individuals have all become victims of  cyber attacks. In this revealing documentary, victims tell how internet criminals have destroyed their lives",1.96,,Documentary,"Tipi'mages, RTS, RSI, ARTE GEIE","France, Switzerland",French
Prospector,0.0,0,0,13,False,en,A short by Talena Sanders.,0.6,,,,United States of America,
And life went on,0.0,0,0,6,False,en,All the neighbours rush dawn the basement/Shelter.  So what is going to happen at this shelter? would every woman cry and scream whilst every man shivers and chews his moustache with rage and fear?.....You will be surprised!,0.0,,,,,
Unearthing the Treasures of Ariyalur,8.0,1,0,26,False,en,"How would one travel time, traverse a chasm spanning millions of years to stare into the past? In the little town of Ariyalur, you can do the impossible. Standing in the midst of a mass grave of prehistoric ocean life, one gets a glimpse of mother earth in her Cretaceous prime and comes face to face with a physical incarnation of time and life of the planet.",0.6,,Documentary,,,English
Human Weapon,0.0,0,0,0,False,en,"A sober, in-depth examination of the complexities of the suicide bombing phenomenon.",0.6,,,,,
La princesse d'Élide,0.0,0,0,0,False,fr,,0.6,,,,,
Late Night,0.0,0,0,15,False,en,Two seemingly professional hitmen attempt to complete a job late at night,0.0,It's gonna be a late night,,,,
Por Dentro do Funk 150 BPM,0.0,0,0,21,False,pt,"While funk from São Paulo took to the mainstream pop, Rio de Janeiro, the birthplace of Brazilian funk, was undergoing major processes of social and political transformation. Military interventions on the eve of the World Cup in 2014 have profoundly altered the dance circuit on the city's hills, pushing the funk ecosystem to the internet and asphalt.",0.6,,Documentary,VICE Media,Brazil,Portuguese
Feet,0.0,0,0,0,False,en,About that feeling when your feet are sore.,0.6,You know that feeling when your feet are sore.,Animation,,Australia,English
Sibling Arrival,0.0,0,0,3,False,en,A coarse but intimate documentary of birth. The eight year old sibling is heard but not seen as she watches and reacts to her brother being born.,0.6,,,,,
Angel on the Amazon,4.0,3,0,86,False,en,An expedition exploring the Amazon jungle comes across a jungle goddess who lives among the animals and fears none of them--and apparently has found the secret of eternal youth.,1.841,The sullen killer of the jungles...and the woman who knew no fear! The story of their meeting and the strange events that followed!,"Adventure, Romance",Republic Pictures,United States of America,English
Videos with Mom: Breast,0.0,0,0,3,False,en,"Single-channel excerpt from installation series. ""An exchange between [the filmmaker's] mother and him in a series of banal, intimate actions: He is attempting to fit her prosthetic breast onto his chest. It doesn’t fit very well, so they try another one. She takes out a bathroom scale and tries to weigh them. “It’s less than a pound, so it doesn’t show,” she said flatly. After wiggling one into a silk bra, she goes to the sink and takes a pill. The film is shot mostly from her point of view at his chest, and we only see her face for barely a second at the very end. We see the back of her head the rest of the time, as she is crouching down in her nightgown weighing the gelatin inserts."" — Tiffany Sia",0.6,,,,,
The Acadian Connection,0.0,0,0,77,False,fr,"National Film Board of Canada documentary of stories of Acadians (French Canadians from the eastern Maritime provinces). Hundreds of thousands of Acadians emigrated to Louisiana following deportation by the British during the Acadian Expulsion of the mid-18th century, hence the term 'Cajun.'",0.6,,Documentary,ONF | NFB,Canada,"English, French"
Ykcowrebbaj,0.0,0,0,8,False,en,Follow the little green bird into this looking-glass world to see a mesmerizing version of the Lewis Carroll poem “Jabberwocky.”,0.6,,,,,
Have a Seat,0.0,0,0,10,False,en,"A young man finds himself in a purgatory waiting room in the afterlife. Here, he is tasked with making the decision of whether or not he wants to see his alcoholic mother again- and the decision between both of them must be mutual.",1.4,How do you feel about your mother?,Drama,Purgatory Productions,,
Pobl Bachyn,0.0,0,0,11,False,en,"A comedy-horror film about the triple threat of Welsh folklore, English tourists and being hungover.",1.4,,Comedy,"Root Around Pictures, Little Wander, BBC, BBC Wales",,
A Horse's Tale,0.0,0,0,0,False,en,An Aesop’s Film Fables short.,0.0,,Animation,,,
Howard Schultz Tapes,0.0,0,0,0,False,en,,0.0,,,,,
Ma fleur maladive,0.0,0,0,43,False,fr,,0.6,,Documentary,,,French
Hari Untuk Amanda,0.0,0,0,102,False,id,"It tells about a girl in hesitation before her marriage, for her ex-lover, who once shared 8 years of romance with her, returns to her life. In the end she must choose one of them.",0.981,,"Drama, Romance","MNC Pictures, Visinema Pictures",Indonesia,Indonesian
Osanazuma: zekkyō!!,2.0,1,0,70,False,ja,Roman Porno from 1976.,0.6,,,Nikkatsu Corporation,Japan,Japanese
Home on the Range,0.0,0,0,54,False,en,Australian independent political documentary about the US installations in Australia at Pine Gap near Alice Springs in the Northern Territory.,0.6,,Documentary,"Australian Film Commission, Association for International Co-operation and Disarmament (N.S.W.)",Australia,
O Jogo da Vida e da Morte,0.0,0,0,94,False,pt,"Brazilian adaptation of Hamlet, set in the outskirts of São Paulo City. A teenager hears through a medium the voice of his father, who accuses his brother of murdering him. He confirms his suspicions of his uncle, and decides to retaliate, but kills the wrong man, triggering a terrible game of life and death.",0.6,,Drama,,Brazil,Portuguese
